"job_id","title","url","company_name","company_page","country","location","job_type","salary","scrape_date","posted","info_remote","description"
"da70ccc1a8fb174a","Bloomberg Data Engineer, DataSF (1043)","https://www.indeed.com/viewjob?jk=da70ccc1a8fb174a","City and County of San Francisco","https://www.indeed.com/cmp/City-and-County-of-SAN-Francisco?campaignid=mobvjcmp&from=mobviewjob&tk=1g11tbbe8s7l1800&fromjk=da70ccc1a8fb174a","us","San Francisco, CA 94102","Full-time","$132,574 - $166,790 a year","2022-04-19","Posted today","City and County of San Francisco - 247 reviews - San Francisco, CA 94102","

  Company Description
   The Mayor’s Office of Innovation is a new team working on Mayoral-directed strategic priorities, emphasizing data analysis, human-centered design thinking, cross-departmental coordination, and public-private partnerships to ensure outcomes-based policy making.
 The Innovation Team is focused on improving service delivery and city performance across the City through replicable, strategic projects in key policy areas like small business recovery, housing, and homelessness and mental health services.
 Priority initiatives include: a customer journey and data insight project to demonstrate how City dollars are funding better outcomes through our non-profit partners:;

 The City grants millions of dollars to non-profit organizations to address homelessness but has no way of demonstrating the outcomes of grants across all departments.
 The City funds services delivered by many non-profit organizations, but has no data set of all City-funded services.
 There is no reliable and up-to-date list of City-funded services that departments and non-profit organizations can use, making it hard for residents to be referred to services when they need help.

 We are looking for a curious and resourceful Data Engineer to show the power of data in bringing transparency and accountability to services, while keeping equity and ethical use of data at the forefront.  Appointment Type: Temporary Exempt (TEX), this position is excluded by the Charter from the competitive Civil Service examination process and shall serve at the discretion of the Appointing Officer.



  Job Description
   As the Innovation Team Data Engineer, you will be a part of the Mayor’s Innovation Team, and report to the Mayor’s Office. However, your position is based within Digital Services under DataSF, and will collaborate closely with the Chief Data Officer and the Chief Digital Services Officer.
 You will work directly with the Mayor’s policy staff and Department leadership, as well as community providers to identify existing data, gaps in reporting, and develop outcomes-based reporting structures.
 This position is funded, in part, through the Bloomberg Philanthropies Government Innovation Team, and will work in close partnership with the Bloomberg Center for Public Innovation at Johns Hopkins University.
 The Innovation Team will also include a Data Program Manager, a Service Designer, and a Project Manager. As a small and agile team, you will work together to deliver prototypes and solutions that will help address the city’s most pressing challenges.
 As the Data Engineer, you will be the technical lead on the program, working with stakeholders in departments to understand data sources and pipelines and building these out in a pragmatic way. You will advise the Mayor’s Office on the most feasible deliverables that are both technically possible, and high impact. You will be supported throughout by the rest of the Innovation team, the Chief Data Officer, and the Chief Digital Services Officer. You will:

 Work with departmental staff to develop extract, transform, load (ETL) requirements for individual datasets
 Consult with various departments on the best way to automate and publish datasets within their data ecosystems
 Apply an ethical lens to the appropriate use of data
 Create new analytics pipelines using ETL/ELT approaches according to standards and patterns you help develop and refine
 Serve as the technical lead for database exports, manipulation, and procedures used to create and update data incorporated into the data platform
 Implement analytics pipelines and/or data models to support analytics work
 Migrate existing ETLs to newer infrastructure to improve data quality and reliability as needed
 Standardize and improve existing pipelines to adhere to best practices
 As needed help iterate and refine best practices

 You will also identify ways in which data standardization, and data access, can contribute to the City’s commitment to equitable and ethical service delivery and analytics. In collaboration with departments, you will identify data gaps that hinder equity analysis.
 Removing barriers and making it easier for all people to access services or knowledge is a core part of any role with DataSF and the Innovation Team. Beyond any technical skill set or prior work history, accomplishing this ambitious task requires an empathetic understanding of the diverse array of experiences embodied in San Francisco. Your own life experience is a critical contribution to this effort. The Innovation Team is committed to building a team whose diversity reflects the residents we serve.



  Qualifications
   1. An associate degree in computer science or a closely related field from an accredited college or university OR its equivalent in terms of total course credits/units [i.e., at least sixty (60) semester or ninety (90) quarter credits/units with a minimum of twenty (20) semester or thirty (30) quarter credits/units in computer science or a closely-related field]; AND
 2. Three (3) years of experience analyzing, installing, configuring, enhancing, and/or maintaining the components of an enterprise network.  Substitution: Additional experience as described above may be substituted for the required degree on a year-for-year basis (up to a maximum of two (2) years). One (1) year is equivalent to thirty (30) semester units/ forty-five (45) quarter units with a minimum of 10 semester / 15 quarter units in computer science or a closely related field.  Desirable Qualifications
 Personal Skills

 Enjoys collaborative processes and developing shared understanding
 Ability to communicate with technical and non-technical audiences
 Investigative ability and intellectual curiosity
 Excellent oral and written communication skills
 Ability to learn and embrace new technologies
 Demonstrated ability working with diverse groups of stakeholders
 Comfort with risk and trying new things
 Ability to work independently and as part of a small team
 Familiarity with Agile development methodology and experience working in iterative development cycles
 Commitment to equity and the use of data to meet the needs of all San Franciscans

 Technical/Knowledge Skills

 Data engineering
 Programming proficiency in Python
 Strong SQL skills
 Experience writing ETL code and/or authoring ETLs through a framework
 Experience working with a variety of databases, APIs, and formats to extract and transform data
 Experience deploying code on cloud-based infrastructure (Azure or AWS preferred)
 Experience training non-technical users to use technology to support their work

 Analytics

 Experience in data cleaning and manipulation for analytics use
 Strong quantitative analysis skills
 Strong data visualization skills
 Experience using business intelligence tools (e.g. PowerBI, Tableau) to develop visualizations

 Data management

 Well-versed in the principles of open data management
 Familiarity with open data platforms and/or data catalogs

 Bonus points if you have:

 Experience with Snowflake/DBT
 Familiarity with Microsoft’s Azure Cloud Tools and/or PowerBI

 Important: Submission of a resume and a cover letter describing why you are applying for this position is REQUIRED at the time of filing. To upload these items, please attach using the “additional attachments” function.
 DataSF encourages applications regardless of whether you think you meet 100% of the skills listed below.  Verification: Applicants may be required to submit verification of qualifying education and experience at any point in the application and/or departmental selection process. Written verification (proof) of qualifying experience must verify that the applicant meets the minimum qualifications stated on the announcement. Written verification must be submitted on employer’s official letterhead, specifying name of employee, dates of employment, types of employment (part-time/full-time), job title(s), description of duties performed, and the verification must be signed by the employer. City employees will receive credit for the duties of the class to which they are appointed. Credit for experience obtained outside of the employee’s class will be allowed only if recorded in accordance with the provisions of the Civil Service Commission Rules. Experience claimed in self-employment must be supported by documents verifying income, earnings, business license and experience comparable to the minimum qualifications of the position. Copies of income tax papers or other documents listing occupations and total earnings must be submitted. If education verification is required, information on how to verify education requirements, including verifying foreign education credits or degree equivalency, can be found at http://sfdhr.org/index.aspx?page=456.
 Note: Falsifying one’s education, training, or work experience or attempted deception on the application may result in disqualification for this and future job opportunities with the City and County of San Francisco.
 Additional Information
  

 Information About The Hiring Process
 Conviction History
 Employee Benefits Overview
 Equal Employment Opportunity
 Disaster Service Worker
 ADA Accommodation
 Veterans Preference
 Right to Work
 Copies of Application Documents
 Diversity Statement

 Compensation: $132,574 - $166,790 annually
 Applicants are encouraged to apply immediately as this recruitment may close at any time.  Late or incomplete submissions will not be considered. Mailed, hand delivered or faxed documents/applications will not be accepted.  In line with the Official Public Health Order to slow the spread of COVID-19, “shelter-in-place” has been issued for all San Francisco residents that is expected to be in effect until further notice. As a result, Department of Human Resources (DHR)’s office (located at 1 South Van Ness Avenue, 4th Floor, San Francisco, CA 94103) is currently closed to the general public. If you have any questions, please feel free to email the Human Resources Analyst listed on this announcement.  Applications will be screened for relevant qualifying experience. Additional screening mechanisms may be implemented in order to determine candidates’ qualifications. Only those applicants who most closely meet the needs of the Agency will be invited to participate in the selection process. Applicants meeting the minimum qualifications are not guaranteed advancement to the interview. Qualified applicants with disabilities requiring reasonable accommodation in the selection process must contact the Agency by phone at (415) 554-6000 or, if hearing impaired at (415) 554-6015 (TTY).  Note: Employees are required to report for in person work for a minimum 2 days per week at City Hall, otherwise remote, or at Digital Services at 1275 Mission Street, San Francisco.

 CONDITION OF EMPLOYMENT: All City and County of San Francisco employees are required to be fully vaccinated against COVID-19 as a condition of employment. Someone is fully vaccinated when 14 days have passed since they received the final dose of a two-shot vaccine or a dose of a one-shot vaccine. Any new hire must present proof of full vaccination status to be appointed. Any new hire who will be routinely assigned or occasionally enter High-Risk Settings, must provide proof of having received a COVID-19 booster vaccine by March 1, 2022, or once eligible.
 The City and County of San Francisco encourages women, minorities and persons with disabilities to apply. Applicants will be considered regardless of their sex, race, age, religion, color, national origin, ancestry, physical disability, mental disability, medical condition (associated with cancer, a history of cancer, or genetic characteristics), HIV/AIDS status, genetic information, marital status, sexual orientation, gender, gender identity, gender expression, military and veteran status, or other protected category under the law.

"
"827521761b0bb70e","Data Engineer + Apprentice (Entry-Level)","https://www.indeed.com/viewjob?jk=827521761b0bb70e","New Apprenticeship","https://www.indeed.com/cmp/New-Apprenticeship?campaignid=mobvjcmp&from=mobviewjob&tk=1g11tbh8tm6db800&fromjk=827521761b0bb70e","us","Jersey City, NJ","Full-time","$35,000 - $45,000 a year","2022-04-19","Posted 6 days ago","New Apprenticeship - 10 reviews - Jersey City, NJ","
Job Description: 
Are you passionate about data and technology? Would you like to be on the forefront of innovation, working in a fast-paced environment with the resources of an established global tech consulting company? In the role of Data Engineer Apprentice, you will be providing support to consulting and technical teams across various stages of the Software Development Life Cycle. You will play a critical role by contributing to the knowledge management process while interfacing with internal teams to ensure high-quality deliverables.
The Data Engineer Apprentice opportunity is for early-career starters interested in breaking into the tech industry while gaining real-world experience. Our apprenticeship is designed to provide a pathway to a successful tech career where opportunities traditionally do not exist. Therefore, we must insist that all applicants have not yet completed their Bachelor’s degree.
We believe in the earn-while-you-learn model, so you will work full-time with our partner company while also participating in New Apprenticeship’s Data Analyst Apprenticeship program which is at no cost to you. The apprenticeship offers small cohorts, learning hands-on from industry experts, certifications, portfolio building, career coaching, mentoring, plus the ability to earn additional credits towards a bachelor's degree.
Furthermore, New Apprenticeship’s Data Analyst Apprenticeship Program is an official registered apprenticeship recognized by the Department of Labor (DOL). Every graduate of a Registered Apprenticeship program receives a nationally-recognized credential from the DOL.
You can learn more about the role and apprenticeship program here: https://hubs.la/Q013KDLt0
Eligibility Requirements: 
Because we understand that you're just beginning your career, we're committed to your learning and growth. We're seeking candidates who have the following requirements.

Prior work experience with data visualization, business analytics, business consulting (IDEAL)
Some coding/programming experience: HTML, Python, R, SAS, Java, C++, SQL, CSS, Scala, Ruby, Perl, etc.
Some combination of advanced Excel and data visualization (Tableau, Google Data Studio, Power BI)

Responsibilities include but are not limited to: 

Develop, construct, test, and maintain architectures
Align architecture with business requirements
Data acquisition
Develop data set processes
Use programming language and tools
Identify ways to improve data reliability, efficiency, and quality

Exclusions: 

Our apprenticeship is designed to provide a pathway to a successful tech career where opportunities traditionally do not exist. Therefore, we must insist that all applicants have not yet completed their Bachelor's degree.

Apprenticeship Benefits: 
As a way to accelerate your growth, you'll participate in New Apprenticeship's Data Analyst Apprenticeship Program remotely while working with our partner company, a global tech consulting firm. Prior to the apprenticeship program start date, you'll receive 9-weeks of in-demand skills acceleration, coaching, and interview preparation in the Pre-Employment Bootcamp program, which is also remote and free of cost to you.
Once you land your full-time role, you'll start the apprenticeship program in a cohort of 10+ apprentices and complete the program over 12 months, where you can earn 24 college credit hours to transfer towards a bachelor's degree online. *(select colleges apply)
You'll attend remote evening sessions twice a week where you'll dive deep into all things data, including business analysis using various techniques, e.g., statistical analysis, explanatory and predictive modeling, python, coding, and data mining. You'll complete milestones along the way, like earning data certifications to validate your skills, module portfolio projects, etc.
You will also receive support from top industry coaches and mentors to progress through your personal and professional goals skills roadmap while also demonstrating new knowledge and competencies through hands-on application with your portfolio project.
Application Process: 

All applicants will go through the New Apprenticeship's interview process, which includes an application, a short project, and an interview with a member of our team.
Accepted candidates will have an additional interview directly with our partner company's hiring manager.

Job Benefits: 

Job Type: Full-time (NOTE: positions are currently remote but may return to in-person)
Salary: $35,000.00 to $45,000.00 /year
Benefits include comprehensive medical and dental plans, life insurance, long-term disability plan, and paid vacation and holidays.
Apprenticeship tuition fees covered as part of your employment - no cost to you

Job Type: Full-time
Pay: $35,000.00 - $45,000.00 per year
Benefits:

Dental insurance
Health insurance
Life insurance
Paid time off

Schedule:

8 hour shift

Work Location: One location
"
"07f05e1684152cb1","Data and Business Intelligence Engineer - Remote","https://www.indeed.com/viewjob?jk=07f05e1684152cb1","Psychology Today","https://www.indeed.com/cmp/Psychology-Today-2?campaignid=mobvjcmp&from=mobviewjob&tk=1g11tbn35t4e0800&fromjk=07f05e1684152cb1","us","Remote","Full-time","$125,000 - $150,000 a year","2022-04-19","Posted today","Psychology Today - Remote - Remote","
We are Psychology Today – the world's #1 psychology site visited by over 40 million people a month. We match thousands of therapists with clients every day. Think Airbnb, but for Therapy. (And yes, we still publish the magazine.)
If you're a talented and experienced data analyst who wants to bring mental health and therapy to the world, then we want to hear from you!
We offer:

Work/life balance
A product and team that will inspire you - so you can do meaningful work with people who make you laugh
A healthy, profitable, and stable company where team members stay for many years
The freedom to work remotely from wherever home is
A supportive platform and a flat structure to do innovative work, be acknowledged, and make a difference
A chance to apply data solutions to big business challenges and opportunities

The Data Engineer works with stakeholders and development teams to support senior stakeholders.
Requirements:

3+ years of relevant experience with detailed knowledge of data warehouse technical architectures, infrastructure components, ETL/ ELT, and reporting/analytic tools.
Experience with AWS analytics services such as Glue, Kinesis, and Athena.
Able to create scripts and programs to automate data operations.
Experience designing and implementing data solutions using industry best practices.
Strong understanding of data structures and algorithms.
Strong understanding and experience with SQL and NoSQL database technologies
Good understanding of how to structure large datasets in a way that allows for responsive reporting and queries.
Ability to generate coherent dashboards and reports from disparate data sources.

On a daily basis, the Data Engineer will:

Work with product owners and development team leads to determine how data/analytics for applications should be structured.
Create and maintain optimal data pipeline architecture.
Transform large and potentially complex data sets into structured data that can be used for dashboards/reporting.
Work with operations and development teams to build out a comprehensive data dashboard/reporting platform.
Identify, design, and implement internal process improvements: automating manual processes, optimizing data delivery, re-designing infrastructure for greater scalability, etc.

Benefits

Highly competitive salaries
No politics: just a collaborative, focused, energetic, work environment that encourages creative solutions
We are a remote business: freedom and independence to work from anywhere
An awesome, talented team of friendly people

Job Type: Full-time
Salary: $125,000.00 - $150,000.00 per year
Benefits:

Flexible schedule
Paid time off

Schedule:

Monday to Friday

Supplemental Pay:

Bonus pay

COVID-19 considerations:This is a remote position - so no COVID concerns.
Work Location: Remote
"
"a39d1ab79e7e7403","Data Engineer (Remote)","https://www.indeed.com/viewjob?jk=a39d1ab79e7e7403","Spruce","https://www.indeed.com/cmp/Spruce?campaignid=mobvjcmp&from=mobviewjob&tk=1g11tbstnm6dk800&fromjk=a39d1ab79e7e7403","us","Remote","Full-time","$105,000 - $120,000 a year","2022-04-19","Posted 10 days ago","Spruce - 19 reviews - Remote - Remote","



About Spruce



 Spruce is the platform enabling modern real estate transactions. We work with forward-thinking mortgage lenders, real estate companies, and investors. We believe that the future of real estate will be driven by automation, efficiency, and digital experiences. Our mission is to provide the products and services necessary to make that happen.
   


 About the job
   


 Spruce is looking for an experienced Data Engineer to join its growing Data Science team. The ideal candidate will have an interest in real estate and will thrive in a fast-paced startup environment.
   


 As a part of the Data Science team, you will help build a cutting edge platform that will define the future of real estate transactions. Your ability to help turn data into practical, production-ready features will help us automate some of the manual work of processing real estate transactions.
   


 The anticipated annual compensation range for this position is $105,000 - $120,000. Stock options are typically a part of the total compensation package determined on a role-by-role basis. Your actual compensation may vary depending on your relevant skills and experience. We provide a competitive benefit package that includes 4 weeks paid PTO, 20 paid sick days, 12 weeks paid parental leave, and comprehensive medical, dental, and vision coverage. We pride ourselves on a culture where everyone is treated with respect, kindness, and appreciation.
   





 What you'll do

 Work closely with Product, Engineering, and Operations as part of a team building the industry’s first automated title search platform Use Python to collect and parse real estate records from 3rd party data sources Using this data, train and implement predictive underwriting models Convert existing offline prototype models to fully automated, high performance production systems





What we're looking for

 1-2 years working experience as a data scientist or data engineer Experience with Python and SQL in a work setting Working knowledge of web-scraping packages such as Selenium Strongly Preferred Advanced degree in a quantitative field or equivalent Experience developing and implementing statistical models, especially in the ML / AI family





    We are proud of the team we’re building. We're committed to equal opportunity employment - and beyond. We believe diverse experiences and perspectives build a stronger team and a better product. We welcome fresh perspectives and challenge our own assumptions to make Spruce better. The more inclusive we are as a company, the better we can serve our customers.
   


"
