"job_id","title","url","company_name","company_page","country","location","job_type","salary","scrape_date","posted","info_remote","description"
"417f94465f37b0f2","Tableau Data Engineer (100% Remote)","https://www.indeed.com/viewjob?jk=417f94465f37b0f2","Piper Companies","https://www.indeed.com/cmp/Piper-Companies?campaignid=mobvjcmp&from=mobviewjob&tk=1g11tc2mlt4cu800&fromjk=417f94465f37b0f2","us","Remote","Full-time","","2022-04-19","Posted 1 day ago","Piper Companies - 14 reviews - Remote - Remote","

Piper Companies is currently searching for a remote Tableau Data Engineer to work as a full time employee for a lead data science firm. 


Overview 



Support the team throughout the project life cycle, including confirming business requirements, contributing to and reviewing design artifacts and technical documentation, prototyping, development, quality testing, user acceptance testing, deployment, and maintenance. 
Ability to design Tableau data flows that allow both internal developers and business users to quickly and intuitively create BI products and make deployment recommendations based on industry best practices and client environment/technology considerations.

 Position Specific Responsibilities:


 Design, develop, and maintain Tableau data flows to join and transform very large datasets from multiple sources into client-ready datasets to support BI products
 Collaborate with internal teams to identify data needs and methods for cleaning, transforming, and standardizing data to meet business requirements
 Perform and document data exploration, data validation, and data mapping/design
 Conduct unit tests and develop database queries to analyze effects and troubleshoot issues
 Represent the company in client-facing meetings


 Qualifications:


 3-5 years of experience building data pipelines and using ETL tools
 2+ years of experience with Tableau, including hands-on experience with Tableau Prep
 Solid understanding of business information systems, database architecture, data modeling, data analysis, testing, and application integration

 Compensation 



Competitive salary with full employee benefits (401k Match, PTO, Holidays, Medical, Dental, Vision, education reimbursement, career advancement, and much MORE!) 



Tableau, Tableau Prep, Data, Data Engineer, Data Developer, Data Programmer, Data Analysis, Data Development, Data Engineering, Extract, Transform, Load, Data Flow, Data Chart, Data Table, Data Graph, Data Validation, Data Confirmation, Data Verification, BI, Business Intelligence, Microsoft, MS, Data Map, Data Design, Data Exploration, Data Architecture, Data Application, Data Integration, Remote, WFH, Work from Home, Telework, Telecommute, Data Science, Salary, Full Time, United States, US Citizen, Green Card, GC, USC, Mid, Senior,

"
"c5e1836974ab269e","Senior Data Engineer","https://www.indeed.com/viewjob?jk=c5e1836974ab269e","Syndio","https://www.indeed.com/cmp/Syndio?campaignid=mobvjcmp&from=mobviewjob&tk=1g11tc8h5m6db801&fromjk=c5e1836974ab269e","us","Remote","","$150,000 - $180,000 a year","2022-04-19","Posted 30+ days ago","Syndio - Remote - Remote","



Remote Home Office 



Do you want to empower organizations to fairly and equitably hire, promote, retain and compensate their employees? Syndio is a Series-C technology company committed to fairness in the workplace. Fueled by investments of $83M from Bessemer Ventures, Voyager Capital and social change organization Emerson Collective, Syndio is investing in growing our team and products.
 This is a critical moment when organizations are looking for ways to take tangible action to fight gender and racial bias, and we believe creating diverse and inclusive workplaces for all starts with workplace fairness.


About the role


We are looking for an experienced data engineer who is excited to take on and solve data challenges at a fast-paced startup. You’ll be responsible for expanding and optimizing our data architecture, as well as optimizing data flow and collection for cross-functional teams. You will integrate data from different sources from around the company into a data lake to serve our R&D, reporting, and analytics needs. You will contribute heavily to the evolution of Syndio’s next-generation data platform, empowering our people and our ever-expanding set of products.
 Why this job is exciting

Design data engineering approaches that align with the company’s overall strategy
Work with backend engineers to implement and maintain the next evolution of our data infrastructure, including our data lake / warehouse.
Participate in building an infrastructure required for optimal extraction, transformation, and loading of data from a wide variety of data sources.
Work with data scientists and product managers to design and build analytics tools that fulfill R&D, product, operational and reporting needs throughout the company.
Assess the value and quality of new data sources.
Assist other engineers in determining and implementing best practices for data management and data hygiene.
Participate in architecture design and discussions.
Provide logical and physical data design, and database modeling.
Solve complex data issues around data integration, unusable data elements, unstructured data sets, and other data processing incidents.

About you

5-10 years of experience, with an emphasis on data warehouses and architecting data pipelines
You are experienced in building distributed/cloud scalable, real-time and high-performance data lake solutions (GCP preferred)
You have experience with hands on coding
You have advanced working knowledge of SQL and familiarity with a variety of relational and non-relational databases (including analytics-focused options and data access patterns)
You have experience with BigQuery or other data warehouses
You have excellent communication skills that enable you to interface with both technical and non-technical teams
You excel in a collaborative environment, supported by a strong team of data scientists, product, and engineering resources
You are ready to work with teams across the organization to ensure data security and maintainability.
You are an experienced problem solver, who can root out issues and find thoughtful solutions.
You are passionate about our mission to close pay gaps and create fairness in the workplace.
You are excited to own and drive initiatives within Syndio that leverage and build your skills and interests



Why you'll love it here


Competitive Compensation. For this role our base salary is targeted at $150k -$180k per year. Final offer amounts are determined by factors such as experience and expertise.
 Additional Incentive. This role participates in our annual performance bonus as well.
 Syndio Equity. So you can share in Syndio’s success.
 Flexible Vacation Policy. We encourage our team to recharge when they need to.
 Up to 12 weeks of paid parental leave
 Medical, Dental, Vision. Syndio pays 90% of employee premiums, and 50% for dependents.
 Life Insurance & Disability. Syndio covers the full premium.
 401(k). To help you save for your future.
✈️ Company paid annual retreats to spend time with the team and have fun together (or a still-pretty-great virtual retreat when there’s a global pandemic)


At Syndio, we're building a diverse team that values candor, curiosity, and community. If you share these values and are interested in joining us, we'd love to talk with you even if you don't 100% meet the 'about you' listed here. We don't expect anyone to have all the answers, as long as you're willing to learn and grow with us.
 Employees joining the Syndio team at this early stage of growth will impact this critical social issue and support a growing customer base (including Nordstrom, General Mills, Match Group, and others) to take tangible action on workplace fairness.
 Syndio is an Equal Opportunity Employer. We are building an inclusive and collaborative workplace as we grow, and we welcome team members regardless of gender/identity, sexual orientation, race or cultural background, religion, physical disability and age.




"
"d92e3936d86af9ca","Data Engineer","https://www.indeed.com/viewjob?jk=d92e3936d86af9ca","Octopus Energy","https://www.indeed.com/cmp/Octopus-Energy?campaignid=mobvjcmp&from=mobviewjob&tk=1g11tcebqsa1u801&fromjk=d92e3936d86af9ca","us","Remote","Full-time","","2022-04-19","Posted today","Octopus Energy - Remote - Remote","



Welcome to the future of energy



 We are both an electricity retailer and a tech platform and we think there is no better way to address our greatest challenge, climate change, than with the combination of those two.
   


 Through our proprietary tech platform, Kraken, we are changing the way people interact with their energy company - by making it approachable, low cost, easy-to-understand, and most importantly, 100% renewable. We’ve distinguished ourselves by being named 2020’s Energy Provider of the Year, which highlights our commitment to exceptional customer service. In many markets we are a leading employer on Glassdoor for best places to work.
   


 At Octopus Energy, we’re developing a data platform that provides data services to all our retail energy businesses around the world. The platform enables self-service of data analytics to hundreds of data hungry users as well as automation of all our data workflows from simple ETL jobs to ML training and prediction. The data platform team works across the whole customer domain on anything from marketing campaign optimization to helping our traders buy the right amount of energy.
   


 Octopus Energy is growing fast and that means lots of data that needs to be ingested, organized, analyzed and shared with the team. We’re looking for a data engineer that can help us with this challenge. You’ll work across all different parts of the business to understand what our team’s needs and deliver data pipelines and tools to meet them. Because it’s still early days, you’ll need to be versatile and be equally comfortable building robust production ready pipelines or hacking together a quick script to run on your machine. You’ll spend most of your time engineering but you should also enjoy analyzing data and building data interfaces like Tableau dashboards or data applications.
   


 You’ll be part of our global data platform team who will provide dev ops and infrastructure support and technical guidance. We’re building a consistent data platform across all Octopus retail businesses in UK, US, Germany, Spain, Japan and NZ so you’ll be part of and contribute to a global data community.
   



What you'll do 

Work with the data scientists and data analysts to scope out and plan new data sources and pipelines Build, automate, deploy and maintain data pipelines Build Streamlet data apps and lend a hand building and maintaining Tableau dashboards Work with the global data platform team to deploy new tools and services into the US data environment Participate in and contribute to our global data community Build the infrastructure required for optimal extraction, transformation, and loading of data from a wide variety of data sources Use an analytical, data-driven approach to drive a deep understanding of fast changing business Build large-scale batch and real-time data pipelines with data processing frameworks in Amazon Web Services, Azure or GCP cloud platform





What you'll need 

First and foremost, we want our data engineers to be great software engineers with a passion for writing high quality code It would be helpful to have experience/expertise in the following (in rough priority order): Python (in combination with Data Pipelines and Analytics) Advanced SQL knowledge and experience working with relational databases, query authoring (SQL) as well as working familiarity with a variety of databases. Experience modeling data for analytics - ideally experience using dbt as a modeling tool Experience building data pipelines in a cloud environment (ideally AWS) Spark The projects will be varied and we’re looking for someone who can work autonomously and proactively to scope problems and solve and deliver pragmatic solutions We want someone who is passionate about building great data tools for our business teams





Why else you'll love it here

 Great medical, dental, and vision insurance options including FSAs. Unlimited paid time off — we know working hard means also being able to recharge as needed, we trust our employees to get the work done and take the time they need. 401(k) plan with employer match. Parental leave. Biological, adoptive and foster parents are all eligible. Pre-tax commuter benefits. Flexible working environment: you need to shift around your schedule? You do you, we genuinely believe in work/life balance. Equity Options: every Octopus employee owns part of the business. We’re a team, working together towards huge goals. Every person is crucial to our success, you should be rewarded as such. Modern office or co-working spaces depending on location. Wondering what the salary for this role is? Just ask us! When on a call with one of our recruiters it's something we always cover as we genuinely want to match your experience with the correct salary. The reason why we don't advertise is because we honestly have a degree of flexibility and would never want salary to be a reason why someone doesn't apply to Octopus - what's more important to us is finding the right octofit!





If this all sounds like you then we'd love to hear from you. 




At Octopus, we're looking for genuinely decent people who are honest and empathetic. Our commitment is to provide equal opportunities, a diverse and inclusive work environment, and fairness for everyone. You are welcome to apply no matter your age, disability, gender, marriage or civil partnership status, pregnancy and maternity status, race, religion or belief, or sexual orientation.




"
"a27aa496c696b4bd","Senior Data Engineer","https://www.indeed.com/viewjob?jk=a27aa496c696b4bd","Talkiatry","https://www.indeed.com/cmp/Talkiatry?campaignid=mobvjcmp&from=mobviewjob&tk=1g11tck60s7gl800&fromjk=a27aa496c696b4bd","us","Remote","Full-time","","2022-04-19","Posted 1 day ago","Talkiatry - 17 reviews - Remote - Remote","
At Talkiatry, we believe mental health is health. We’re a successful, high-growth organization creating the gold standard in mental healthcare and helping people live their best lives. More specifically, we’re solving the behavioral health crisis in America by focusing on high-quality in-network care and proprietary technology that redefines how patients access and receive psychiatric care. The result? Through a personalized approach, we meet the needs of patients, physicians, and insurance partners while driving down costs and improving care.
As a Senior Data Engineer, your main goal is to work closely with our data scientists and analysts. You will support them by providing infrastructure and tools they can use to deliver end-to-end solutions to business problems that can be developed rapidly and maintained easily.
Essential Functions: 

Partner with business, analytics, and engineering teams to design and build data pipelines, and define the overall ETL strategy
Institute data quality checks and implement monitoring in the pipelines to ensure confidence in the data
Be a key contributor to the data modeling of the data warehouse
Perform SQL tuning as necessary
Carry out ad-hoc analysis as necessary

Qualifications: 

5+ years of experience working as a Data Engineer
3+ years of experience working with Python
2+ years of experience working with an orchestration tool like Airflow
2+ years of experience working with cloud data warehouses (Snowflake, Redshift, etc.)
Proficient in SQL and Data Modeling (experience with dbt is a plus, but not required)
Experience working within cloud computing environments such as AWS, Azure, Google Cloud
Experience working with streaming data is a plus, but not required
Comfort working in a dynamic environment with several ongoing concurrent projects
Ability to work independently and cross-functionally with team members of all levels

At Talkiatry, we are an equal opportunity employer committed to a diverse, inclusive, and equitable workplace and candidate experience. We strive to create an environment where everyone has a sense of belonging and purpose, and where we learn from the unique experiences of those around us.
We encourage all qualified candidates to apply regardless of race, color, ancestry, religion, national origin, sexual orientation, age, citizenship, marital or family status, disability, gender, gender identity or expression, pregnancy or caregiver status, veteran status, or any other legally protected status.
Job Type: Full-time
Benefits:

401(k)
401(k) matching
Dental insurance
Health insurance
Health savings account
Life insurance
Paid time off
Parental leave
Vision insurance

Schedule:

Monday to Friday

Work Location: Remote
"
"7d4ad7b9d9a70a50","Data Engineer (Remote)","https://www.indeed.com/viewjob?jk=7d4ad7b9d9a70a50","Octave","https://www.indeed.com/cmp/Octave-2?campaignid=mobvjcmp&from=mobviewjob&tk=1g11tcpvls7gl801&fromjk=7d4ad7b9d9a70a50","us","Remote","Full-time","","2022-04-19","Posted 30+ days ago","Octave - Remote - Remote","
Octave is a national behavioral health practice creating a new standard for care delivery that’s both high-quality and accessible to more people. With in-person and virtual clinics in California and New York, we offer personalized care plans that can include individual therapy, couples therapy, and groups, while pioneering relationships with payers to make care more affordable through insurance. Grounded in science, Octave enables clients to experience profound change that is as measurable as it is meaningful. Learn more at www.findoctave.com
Job Type: Full-time
"
"460cce461bec5669","Data Engineer","https://www.indeed.com/viewjob?jk=460cce461bec5669","Amazon.com Services LLC","https://www.indeed.com/cmp/Amazon.com?campaignid=mobvjcmp&from=mobviewjob&tk=1g11tcvu63khl001&fromjk=460cce461bec5669","us","Remote","Full-time","$132,090 - $178,710 a year","2022-04-19","Posted 30+ days ago","Amazon.com Services LLC - 81,086 reviews - Remote - Remote","

Bachelor’s/Masters degree in Computer Science or related technical field, or equivalent work experience.
4+ years of work experience with ETL, Data Modeling, and Data Architecture.
2+ years of work experience with Python, Scala or other scripting languages.
Knowledge of AWS services including S3, Redshift, EMR, Kinesis and RDS.
Experience with Big Data Technologies (Hadoop, Hive, Hbase, Pig, Spark, etc.)
Knowledge of distributed systems as it pertains to data storage and computing
 Job summary 
 AWS Support is one of the largest and fastest growing business units within AWS. We are a highly technical, innovative organization revolutionizing the customer engagement processes and offers topnotch technical support for the portfolio of products and features of AWS. We are determined to redefine the word “Support” and lead the industry with best in class technology. 
 We are looking for an excellent Data Engineer who is passionate about data and the insights that large amounts of data sets can provide. You should possess both a data engineering background and a business acumen that enables you to think strategically. You will experience a wide range of problem solving situations requiring extensive use of data collection and analysis. The successful candidate will work in lock-step with BI Engineers, Data scientists, ML scientists, Business analysts, Product Managers and other stakeholders across organization. You will: 
 

Develop and improve the current data architecture, data quality, monitoring and data availability.
Collaborate with Data Scientists to implement advanced analytics algorithms that exploit our rich data sets for statistical analysis, prediction, clustering and machine learning
Partner with BAs across teams to build and verify hypothesis to improve the AWS Support business.
Help continually improve ongoing reporting and analysis processes, simplifying self-service support for customers
Keep up to date with advances in big data technologies and run pilots to design the data architecture to scale with the increased data sets of customer experience on AWS.
Experience in ETL optimization, designing, coding, and tuning big data processes using Apache Spark or similar technologies.
Experience with building data pipelines and applications to stream and process datasets at low latencies.
Experience handling data - tracking data lineage, ensuring data quality, and improving discoverability of data.
Knowledge of distributed systems and data architecture (lambda)- design and implement batch and stream data processing pipelines, knows how to optimize the distribution, partitioning, and MPP of high-level data structures.
Experience with native AWS technologies for data and analytics such as Redshift Spectrum, Athena, S3, Lambda, Glue, EMR, Kinesis, SNS, CloudWatch, etc.
 The base pay range for this position in Colorado is $132,090 - $178710/yr; however, base pay offered may vary depending on job-related knowledge, skills, and experience. A sign-on bonus and restricted stock units may be provided as part of the compensation package, in addition to a full range of medical, financial, and/or other benefits, dependent on the position offered. This information is provided per the Colorado Equal Pay Act. Base pay information is based on market location. Applicants should apply via Amazon's internal or external careers site. 
 
 Amazon is committed to a diverse and inclusive workplace. Amazon is an equal opportunity employer and does not discriminate on the basis of race, national origin, gender, gender identity, sexual orientation, protected veteran status, disability, age, or other legally protected status. For individuals with disabilities who would like to request an accommodation, please visit https://www.amazon.jobs/en/disability/us.
"
