"job_id","title","url","company_name","company_page","country","location","job_type","salary","scrape_date","posted","info_remote","description"
"c98d04536fc5e772","Lead Data Engineer","https://www.indeed.com/viewjob?jk=c98d04536fc5e772","Sendoso","https://www.indeed.com/cmp/Sendoso?campaignid=mobvjcmp&from=mobviewjob&tk=1g11td5ojt4qp800&fromjk=c98d04536fc5e772","us","Remote","Full-time","$84,626 - $185,408 a year","2022-04-19","Posted 1 day ago","Sendoso - 10 reviews - Remote - Remote","
Who We Are: 
Sendoso is where you go to build something bigger than yourself. We’re a Series C company with $152M in venture capital funding with more than 800+ customers and 20,000 active users, and multiple revenue streams. Our company is on an unprecedented growth trajectory and we’re looking for people who want to do great things.
Sendoso is the leading Sending Platform that delivers modern direct mail, personalized gifts, eGifts, and other Physical Impressions™ at scale. This makes it possible to build stronger, deeper, and more trusted relationships that move everything up and to the right! Our award-winning Sending Platform connects online and offline experiences via cloud software, automation, and real-world logistics—a feat that few companies have achieved.
Our mission statement is to help companies rise above the noise by eradicating spam and elevating relationships. Our goal is to enable businesses everywhere to make more human connections in a digital world.
We are unable to hire in the following states at this time: CO, HI
About the Role: 
The Data Science and Engineering team at Sendoso is new and growing rapidly. The team is responsible for Data Science and Analytics initiatives, including product recommendations and search, fraud detection, experimentation, and analytics. We’re looking for a Lead Data Engineer to help improve our data architecture, pipelines, and practices and work with the Data Science, Product, and Engineering leadership to drive the business forward.
What You'll Do:

Develop and maintain a data architecture that aligns with business needs
Work with Data Science and Business Intelligence teams to develop data models and pipelines to support reporting and the development of new data products
Work with our Data Scientists and DevOps teams to streamline our Data Science workflows
Consistently identify ways to improve our data reliability, efficiency, and quality

Experience:

5+ years of experience (tech and start-up experience preferred)
Coding and software design skills, particularly in Python and SQL, and experience collaborating within a shared codebase.
A detail-oriented approach to problem-solving, carefully thinking through the business problem, data, model, and evaluation.
A demonstrated track record of communicating technical concepts to stakeholders with both technical and non-technical backgrounds.
An ability to multitask, splitting your time between working on your projects, helping team members, and engaging with the business to identify new opportunities.

What We Believe:

Conquer Giants! We get things done. Moxie is in our DNA, and we’re breaking down the barriers that separate the world.
One Team! Everyone belongs here, and whether it is your first day or you’re the CEO, your voice and ideas matter to us.
Relationships Matter! It’s a cluttered, digital world out there, but our connections are real. We’re all humans, so we treat each other and our customers like humans too.
Reinvent! Forget thinking big. We think meteorically by redefining what’s possible and shaping the future of human connections.

What You'll Love:

Comprehensive Medical Plans plans - we've got you covered
Take-What-You-Need Time Off
Vacation Bonuses 2X/Year
401K Plan
FSA Plan
Employer-paid membership to One Medical
Volunteer Time Off
Birthday Time Off
Generous parental leave benefits for both birthing and non-birthing parents
Access to Employee Assistance Programs (EAPs)
Fitness discounts through ClassPass
End-to-end family planning discounts through KindBody
Discounted pet insurance through PetPlan
Free and discounted legal benefits through Rocket Lawyer
Financial wellness benefits through SoFi
Team Outings

We're currently working from home due to Covid-19, and the following will apply once we're safely back in the office:

Catered Lunch & Breakfast
Dog Friendly Offices
Collaborative Office Space
Stocked Kitchen

Sendoso is an equal opportunity employer: we value diversity. We do not discriminate on the basis of race, religion, color, national origin, gender, sexual orientation, age, marital status, veteran status, or disability status.
Job Type: Full-time
Pay: $84,626.00 - $185,408.00 per year
Schedule:

Monday to Friday

Work Location: Remote
"
"d16a56a68f5fccbc","Data Engineer - Remote","https://www.indeed.com/viewjob?jk=d16a56a68f5fccbc","Medical Mutual of Ohio","https://www.indeed.com/cmp/Medical-Mutual-of-Ohio?campaignid=mobvjcmp&from=mobviewjob&tk=1g11tdbj3t4ja800&fromjk=d16a56a68f5fccbc","us","United States","Full-time","","2022-04-19","Posted 30+ days ago","Medical Mutual of Ohio - 144 reviews - United States - Remote","


Data Engineer - Remote - (2200050)
  


 This position will be Remote.
Founded in 1934, Medical Mutual is the oldest and one of the largest health insurance companies based in Ohio. We provide peace of mind to more than 1.6 million Ohioans through our high-quality health, life, disability, dental, vision and indemnity plans. We offer fully insured and self-funded group coverage, including stop loss, as well as Medicare Advantage, Medicare Supplement and individual plans.
Medical Mutual’ s status as a mutual company means we are owned by our policyholders, not stockholders, so we don’t answer to Wall Street analysts or pay dividends to investors. Instead, we focus on developing products and services that allow us to better serve our customers and the communities around us and help our members achieve their best possible health and quality of life.
Software developer for the design and development of the company’s data lake, data warehouse, and data marts, and development of related business intelligence dashboards and visualizations. Job duties involve profiling data, developing data transformation jobs and processes, measuring data quality, and designing data warehouse data models, evaluating usability and testing data models, and developing business intelligence visualizations. 
Responsibilities

Developing and sequencing jobs and processes to transform data into data lake and data warehouse
Visualizations, analytic projects, data extracts, and other work to apply data in the warehouse, test and prove capabilities, evaluate usability, and perform demonstrations to other analysts for how to use data to meet their objectives
Business meetings to understand data, capture agreement on business rules, understand analyst and stakeholder objectives, and support usage of data to solve business problems
Data profiling, data documentation, and measuring data quality with manual verification and 
development of automated data quality tests
Developing data models to represent data
Learns new technical concepts and software languages as needed.
Performs other duties as assigned







Qualifications 
Education and Experience:
Level II:

Bachelor’s degree in computer science, business or related field or equivalent experience.
Minimum 2 years information systems experience.

Level IV:

Bachelor’s degree in computer science, business or related field or equivalent experience. 
Master’s degree in computer science, business or related field or equivalent experience preferred.
Minimum 6 years information systems experience. 
Minimum 4 years analysis and design experience.

Preferred Technical Skills and Knowledge: 

Experience with ETL technology and techniques
Understanding of data warehouse modeling theory and techniques
Experience with Hadoop and Apache Spark development
Experience with Java or Scala programming languages and JDK
Experience with R programming language
Experience with Python programming language
Data analytic and visualization experience using R or Python

Medical Mutual is looking to grow our team! We truly value and respect the talents and abilities of all of our employees. That's why we offer an exceptional package that includes:
A Great Place to Work:

Top Workplace in Northeast Ohio. Year after year we've received this recognition!
On-site wellness center at most locations. Enjoy personal trainers, towel service, locker room, weight room, elliptical machines, and a variety of classes!
On-site cafeteria serving hot breakfast and lunch, at most locations. Choices ranging from salad bar, made to order, hot and cold sandwiches, or a variety of entrees cooked fresh daily. Convenience store at most locations
Employee discount program. Discounts at many places in and around town, just for being a Medical Mutual team member
Business Casual attire

Excellent Benefits and Compensation:

Competitive compensation plans
Employee bonus program
401(k) with company match and an additional company contribution
Excellent medical, dental, vision, and disability insurance

An Investment in You:

Career development programs and classes
Mentoring and coaching to help you advance
Education reimbursement up to $5K per year

About Medical Mutual:
We strive to create peace of mind. Our customers can trust us to do things right and to help them get value from their health plan. We're the largest health insurer in Ohio and for over 85 years, we've been serving our members and the Ohio communities where they live and work. Medical Mutual is a Top Place to Work in Northeast Ohio with exceptional career opportunities that offer challenge, growth and a great work/life balance. We want talented, innovative, and driven people to help us continue to be the best health insurance choice of Ohioans and help make Ohio the best it can be! Our headquarter building is located in the heart of downtown Cleveland and we have multiple offices throughout the state. Join us at one near you!
At Medical Mutual and its family of companies we celebrate differences and are mutually invested in our employees and our community. We are proud to be an Equal Employment Opportunity and Affirmative Action Employer. Qualified applicants will receive consideration for employment regardless of race, color, religion, sex, sexual orientation, gender perception or identity, national origin, age, marital status, veteran status, or disability status.
We maintain a drug-free workplace and perform pre-employment substance abuse and nicotine testing.





 Primary Location United States
  

 Job 7 - General Staff
  

 Organization IT Infrastructure
  

 Schedule Regular
  

 Shift Standard
  

 Employee Status Individual Contributor
  

 Job Type Full-time
  

 Job Level Day Job
  

 Job Posting Mar 24, 2022, 2:23:27 PM
  

"
