"job_id","title","url","company_name","company_page","country","location","job_type","salary","scrape_date","posted","info_remote","description"
"063ac511572a5830","Data Engineer","https://www.indeed.com/viewjob?jk=063ac511572a5830","Farm Credit Services of America","https://www.indeed.com/cmp/Farm-Credit-Services-of-America?campaignid=mobvjcmp&from=mobviewjob&tk=1g11taee4t4me800&fromjk=063ac511572a5830","us","Omaha, NE 68137","Full-time","$104,440 a year","2022-04-19","Posted today","Farm Credit Services of America - 52 reviews - Omaha, NE 68137","




     Data Engineer 
    






Job ID: 1559 
Job Category: Information Technology 
Employment Type: Full-Time 
Relocation Available: Yes 
Location: Omaha, NE 
Team: Database 




Salary Range: $104,440 - $161,880 
Grade Level: 25D 
Incentive/Bonus Opportunities Available 
Closing Date: May 16, 2022















Position Description:  
Farm Credit Services of America (FCSAmerica) is looking to hire someone who will be responsible for building the infrastructure to answer questions with data, using software engineering best practices, data management fundamentals, data storage principles, and recent advances in distributed systems.
 As a Data Engineer, you will champion adoption of best practices in data management: data integrity, test design, analysis, validation and automation. While delivering on data solutions you will help drive the architecture and technology choices that enable a world-class user experience.
 Responsibilities:

 Work with architecture, engineering leads and other teams to ensure quality solutions are implemented, and engineering best practices are defined and adhered to
 Serve as an expert in data engineering for other technology teams and serve as a mentor/coach
 Understands complex multi-tier, multi-platform systems
 Develop sustainable data driven solutions with current new gen data technologies to meet the needs of our customers, business, and organization
 Profile and analyze data for the purpose of designing scalable solutions
 Define and apply appropriate data acquisition and consumption strategies for given technical scenarios
 Design and implement distributed data processing pipelines using tools and languages
 Contribute to overall architecture, frameworks and patterns for processing and storing data
 Translate data product backlog items into engineering designs and logical units of work
 Develop and improve the current data architecture and improve monitoring, alerting & remediation
 Anticipate, identify and solve issues concerning data management to improve data quality, privacy and experience

 Minimum Qualifications:

 Bachelor’s degree in Computer Science, Management Information Systems, Data Governance, Data Management or comparable experience in a related field required.
 Minimum of five years Data Engineering, Software Development or Infrastructure Design

 Preferred Qualifications:

 Desired skills or experience in: Data Lake ecosystems, Metadata Management, Data Modeling, Data Cataloging, Data Quality Workflow and Remediation tools, and Master Data Management are preferred.
 Demonstrated strong analytical, investigative, written, oral, and organizational skills.
 Effective human relations skills and ability to develop strong relationships with leadership and others within the Associations.








"
"709cbd469c5ab942","Data Engineer I.","https://www.indeed.com/viewjob?jk=709cbd469c5ab942","Tulane University","https://www.indeed.com/cmp/Tulane-University?campaignid=mobvjcmp&from=mobviewjob&tk=1g11tak9kj7a1800&fromjk=709cbd469c5ab942","us","New Orleans, LA","","","2022-04-19","Posted today","Tulane University - 373 reviews - New Orleans, LA","The Data Engineer I is responsible for the installation, testing, maintenance, and development of scalable data-management systems. The Data Engineer I is responsible for the execution and monitoring of Extract, Transform, Load (ETL) operations. Additional responsibilities of the position include conducting data analysis, data integrity, and quality assurance testing; creating reports and dashboards for data consumption by the user community; assisting the Data Architect Team with evaluating data-management technologies, and performs other related tasks as assigned. Required Knowledge, Skills, and Abilities
Excellent oral and written communication skills.
Excellent analytical and problem solving skills.
Ability to effectively identify and troubleshoot issues, as well as provide viable solutions and/or recommendations.
Highly proficient data analysis and data management skills.
Working knowledge of Agile Practices.
Familiarity with multiple programming languages and frameworks.
Working knowledge of SDLC Methodologies and Practices .
Sound knowledge of SQLServer, Oracle, NoSQL and Graph databases.
Demonstrated proficiency in the utilization of Data Visualization tools (Cognos, Power BI, MicroStrategy, or similar tools.
Proficient use of Informatica or similar ETL tools.
Ability to efficiently install and support data management systems, including databases, data design software, and ETL software.
Required Education and/or Experience
Bachelor's Degree and two (2) years' IT experience, including SQL, Data Modeling tools, ETL, Data Warehousing, Data Visualization, Linux and Windows OS experience, plus one (1) year Agile Project Management experience;
OR
High School Diploma/Equivalent and eight (8) years' IT experience, including SQL, Data Modeling tools, ETL, Data Warehousing, Data Visualization, Linux and Windows OS experience, plus one (1) year Agile Project Management experience.
Preferred Qualifications
Business Intelligence experience in Higher Education."
"c98d04536fc5e772","Lead Data Engineer","https://www.indeed.com/viewjob?jk=c98d04536fc5e772","Sendoso","https://www.indeed.com/cmp/Sendoso?campaignid=mobvjcmp&from=mobviewjob&tk=1g11taq23t4qp800&fromjk=c98d04536fc5e772","us","Remote","Full-time","$84,626 - $185,408 a year","2022-04-19","Posted 1 day ago","Sendoso - 10 reviews - Remote - Remote","
Who We Are: 
Sendoso is where you go to build something bigger than yourself. We’re a Series C company with $152M in venture capital funding with more than 800+ customers and 20,000 active users, and multiple revenue streams. Our company is on an unprecedented growth trajectory and we’re looking for people who want to do great things.
Sendoso is the leading Sending Platform that delivers modern direct mail, personalized gifts, eGifts, and other Physical Impressions™ at scale. This makes it possible to build stronger, deeper, and more trusted relationships that move everything up and to the right! Our award-winning Sending Platform connects online and offline experiences via cloud software, automation, and real-world logistics—a feat that few companies have achieved.
Our mission statement is to help companies rise above the noise by eradicating spam and elevating relationships. Our goal is to enable businesses everywhere to make more human connections in a digital world.
We are unable to hire in the following states at this time: CO, HI
About the Role: 
The Data Science and Engineering team at Sendoso is new and growing rapidly. The team is responsible for Data Science and Analytics initiatives, including product recommendations and search, fraud detection, experimentation, and analytics. We’re looking for a Lead Data Engineer to help improve our data architecture, pipelines, and practices and work with the Data Science, Product, and Engineering leadership to drive the business forward.
What You'll Do:

Develop and maintain a data architecture that aligns with business needs
Work with Data Science and Business Intelligence teams to develop data models and pipelines to support reporting and the development of new data products
Work with our Data Scientists and DevOps teams to streamline our Data Science workflows
Consistently identify ways to improve our data reliability, efficiency, and quality

Experience:

5+ years of experience (tech and start-up experience preferred)
Coding and software design skills, particularly in Python and SQL, and experience collaborating within a shared codebase.
A detail-oriented approach to problem-solving, carefully thinking through the business problem, data, model, and evaluation.
A demonstrated track record of communicating technical concepts to stakeholders with both technical and non-technical backgrounds.
An ability to multitask, splitting your time between working on your projects, helping team members, and engaging with the business to identify new opportunities.

What We Believe:

Conquer Giants! We get things done. Moxie is in our DNA, and we’re breaking down the barriers that separate the world.
One Team! Everyone belongs here, and whether it is your first day or you’re the CEO, your voice and ideas matter to us.
Relationships Matter! It’s a cluttered, digital world out there, but our connections are real. We’re all humans, so we treat each other and our customers like humans too.
Reinvent! Forget thinking big. We think meteorically by redefining what’s possible and shaping the future of human connections.

What You'll Love:

Comprehensive Medical Plans plans - we've got you covered
Take-What-You-Need Time Off
Vacation Bonuses 2X/Year
401K Plan
FSA Plan
Employer-paid membership to One Medical
Volunteer Time Off
Birthday Time Off
Generous parental leave benefits for both birthing and non-birthing parents
Access to Employee Assistance Programs (EAPs)
Fitness discounts through ClassPass
End-to-end family planning discounts through KindBody
Discounted pet insurance through PetPlan
Free and discounted legal benefits through Rocket Lawyer
Financial wellness benefits through SoFi
Team Outings

We're currently working from home due to Covid-19, and the following will apply once we're safely back in the office:

Catered Lunch & Breakfast
Dog Friendly Offices
Collaborative Office Space
Stocked Kitchen

Sendoso is an equal opportunity employer: we value diversity. We do not discriminate on the basis of race, religion, color, national origin, gender, sexual orientation, age, marital status, veteran status, or disability status.
Job Type: Full-time
Pay: $84,626.00 - $185,408.00 per year
Schedule:

Monday to Friday

Work Location: Remote
"
"990e2b74bb3e2169","Data / BI Engineer","https://www.indeed.com/viewjob?jk=990e2b74bb3e2169","TARGET","https://www.indeed.com/cmp/Target?campaignid=mobvjcmp&from=mobviewjob&tk=1g11tavqst49j800&fromjk=990e2b74bb3e2169","us","Brooklyn Park, MN 55445","Full-time","","2022-04-19","Posted today","TARGET - 59,783 reviews - Brooklyn Park, MN 55445","

JOIN TARGET DATA SCIENCES AS A DATA / BI ENGINEER – DIGITAL MARKETING

 About This Opportunity:

 Join Target’s global Data Engineering team where your goal is to provide simple, speedy and quality data solutions (data pipelines), which enable Target advanced algorithm - data scientists build robust data models that help leaders make timely and accurate decisions. Take part in Target Data Sciences ’50 Days of Learning’ culture by mentoring with internal technical experts/advisors, attending industry conferences, Demo Days/Incubators as well as volunteering opportunities!

 The Data Engineer is responsible for the implementation of data sciences programs and practices to deliver relevant, timely and insightful information to the business partners. The Engineer is also accountable for developing code and configuring software that generates required data in support of large scale reporting and analysis as well as foundational data sets for business units (Marketing, Supply Chain, Stores, HR, Finance, etc.).

 As a Data Engineer supporting our Marketing team, you’ll take the lead as you…

 Assess client needs and convert business requirements into BI solutions roadmap relating to complex issues involving long-term or multi-work streams
 Analyze technical issues and questions identifying data needs and delivery mechanisms
 Implement data structures using best practices in data modeling, ETL/ELT processes, SQL, database, and OLAP technologies
 Build data caches and performant APIs following internal standards and best practices
 Develop BI applications that can be deployed quickly and in an automated fashion
 Embrace the DataOps mentality (CI/CD) by building solutions designed for availability and scalability in an iterative manner


 Requirements:

 BS in Computer Science, Engineering or relevant work experience
 1 plus year of experience in a Data Engineering and/or software development
 Core programming skills in Java, Scala, Python or C++
 Knowledge or experience with a variety of database technologies (HBase, Postgres, Cassandra, SQL Server and Oracle)
 Experience interfacing with the Hadoop ecosystem (Hive, Pig, Spark)
 Knowledge of streaming technologies (Kafka) and ETL/other data Integration patterns
 Knowledge with design of data integration using API’s
 Knowledge designing various data models to ensure scalability and performance of data usage
 Working knowledge of CI/CD toolchain (either Drone, Jenkins, Kubernetes)
 Constant learner who enjoys working with highly collaborative, inclusive, global team


 Americans with Disabilities Act (ADA)

 Target will provide reasonable accommodations (such as a qualified sign language interpreter or other personal assistance) with the application process upon your request as required to comply with applicable laws. If you have a disability and require assistance in this application process, please visit your nearest Target store or Distribution Center or reach out to Guest Services at 1-800-440-0680 for additional information.
 Qualifications:
 
"
"b723184b73599161","Senior Data Engineer","https://www.indeed.com/viewjob?jk=b723184b73599161","Rand Whitney Mid-Atlantic","https://www.indeed.com/cmp/New-England-Revolution-Kraft-Soccer?campaignid=mobvjcmp&from=mobviewjob&tk=1g11tb5kts9sn800&fromjk=b723184b73599161","us","Braintree, MA","Full-time","From $84,626 a year","2022-04-19","Posted 1 day ago","Rand Whitney Mid-Atlantic - Braintree, MA","
The Data Engineer 3 will drive the planning, design, and development of integration processes to build and improve the data warehouse. The Data Engineer will be responsible for building data integrations, data pipelines and other processes the data warehouse and KAGR product. This role will partner with Data Scientists, Analysts, other engineers and business stakeholders to solve complex and exciting challenges so that we can build our product to enable our clients to use data to drive their business.
DUTIES AND RESPONSIBILITIES

Building data integrations and data pipelines within the KAGR tech stack
Translate business requirements into data pipelines
Extract and load many disparate systems into a centralized data warehouse
Assist in gathering requirements for new pipelines
Implement data auditing strategies and processes to ensure data integrity
Document complex integration pipelines into easy-to-understand technical specifications
Perform data modeling to document existing and new tables in the data warehouse
Monitor and successfully troubleshoot data problems
Handle multiple projects effectively and meet deadlines
Special projects and assignments as business dictates
Responsible for the maintenance, creation and control of all personally identifiable information or any other information protected by any Confidentiality or Privacy Standards or Company policies that you have access or knowledge of, including but not limited to any state or federal regulations including HIPAA

SUPERVISORY RESPONSIBILITIES
This position has no supervisory responsibilities.
SKILLS AND QUALIFICATIONS

Bachelor's Degree in Computer Science, Information Systems, or related field
4-7 years of experience working with data using SQL or similar technology
3+ years of experience using cloud data warehouses such as Snowflake, Amazon Redshift, Google BigQuery, Azure Synapse
Experience with languages like Python, Ruby, Java, or similar language
3+ years of experience using a data integration platform, such as Talend, Snaplogic, or Informatica
Experience working in a cloud native environment
Strong understanding of data warehousing principles and methodologies
Ability to manage multiple projects in a fast-paced environment
Strong communication skills to all levels of technical expertise
Very high attention to detail
Familiarity with BI Visualization tools

PHYSICAL DEMANDS

Sitting for extended periods of time
Dexterity of hands and fingers to operate a computer keyboard, mouse, and other computing equipment
The employee frequently is required to talk or hear
The employee is occasionally required to reach with hands and arms
Specific vision abilities required by this job include close vision, distance vision, color vision, peripheral vision, depth perception, and ability to adjust focus
Reasonable accommodations may be made to enable individuals with disabilities to perform the essential functions.

WORK ENVIRONMENT

The noise level in the work environment is usually moderate
Fast paced office environment
Ability to work nights and weekends as business dictates

CERTIFICATES, LICENSES, REGISTRATIONS
None required
OTHER DUTIES
Please note this job description is not designed to cover or contain a comprehensive listing of activities, duties or responsibilities that are required of the employee for this job. Duties, responsibilities and activities may change at any time with or without notice.
This company is an equal opportunity employer. We evaluate qualified applicants without regard to race, color, religion, sex, sexual orientation, gender identity, national origin, disability, veteran status, and other legally protected characteristics.
Job Type: Full-time
Pay: From $84,626.00 per year
Benefits:

401(k)
Dental insurance
Health insurance
Paid time off
Vision insurance

Schedule:

8 hour shift

Work Location: One location
"
